{"schema_version":"referent-binding.v1","protocol":"worldeval-conversation/0.1.0","binding_id":"binding-box","task_id":"task-1","conversation_id":"warehouse-chat-1","command_message_id":"message-1","hypothesis_set_id":"hypotheses-1","candidate_id":"candidate-blue-box","entity":{"entity_id":"box-blue-1","generation":1,"type_id":"box"},"visible_evidence":{"observation_seq":4,"tick":12,"state_hash":"sha256:1111111111111111111111111111111111111111111111111111111111111111","visible_entity_id":"box-blue-1","generation":1},"bound_by":"unique_visible_candidate","expires_at_observation_seq":8,"status":"active"}
